{
  "project_name": "Тумба под оргтехнику 1200×350×740",
  "furniture_type": "тумба",
  "overall_dimensions": {
    "width": 1200,
    "depth": 350,
    "height": 740,
    "tolerance": 5
  },
  "materials": {
    "board_material": "ЛДСП",
    "board_thickness": 22,
    "back_wall_material": "ДВП",
    "edge_band_thickness": 0.4,
    "color": "Белый",
    "color_code": ""
  },
  "sections": [
    {
      "id": "left",
      "type": "door",
      "dimensions": {
        "width": 567,
        "height": 696,
        "depth": 266.8,
        "estimated": false
      },
      "elements": [
        "Полка левая (left)"
      ]
    },
    {
      "id": "right",
      "type": "door",
      "dimensions": {
        "width": 567,
        "height": 696,
        "depth": 266.8,
        "estimated": false
      },
      "elements": [
        "Полка правая (right)"
      ]
    }
  ],
  "panels": [
    {
      "name": "Дно",
      "type": "bottom",
      "basis_orientation": "horizont",
      "material": "ЛДСП",
      "thickness": 22,
      "dimensions": {
        "width": 1200,
        "height": 270
      },
      "placement": {
        "x1": 0,
        "x2": 1200,
        "y1": 0,
        "y2": 22,
        "z1": 0,
        "z2": 270
      },
      "position": {
        "x": 0,
        "y": 0,
        "z": 0
      },
      "rotation": {
        "x": 0,
        "y": 0,
        "z": 0
      },
      "edge_banding": {
        "top": 0.4,
        "bottom": 0.4,
        "left": 0.4,
        "right": 0.4
      },
      "estimated": false
    },
    {
      "name": "Крышка",
      "type": "top",
      "basis_orientation": "horizont",
      "material": "ЛДСП",
      "thickness": 22,
      "dimensions": {
        "width": 1200,
        "height": 350
      },
      "placement": {
        "x1": 0,
        "x2": 1200,
        "y1": 718,
        "y2": 740,
        "z1": -80,
        "z2": 270
      },
      "position": {
        "x": 0,
        "y": 718,
        "z": -80
      },
      "rotation": {
        "x": 0,
        "y": 0,
        "z": 0
      },
      "edge_banding": {
        "top": 0.4,
        "bottom": 0.4,
        "left": 0.4,
        "right": 0.4
      },
      "estimated": false
    },
    {
      "name": "Боковина левая",
      "type": "side_left",
      "basis_orientation": "vertical",
      "material": "ЛДСП",
      "thickness": 22,
      "dimensions": {
        "width": 270,
        "height": 696
      },
      "placement": {
        "x1": 0,
        "x2": 22,
        "y1": 22,
        "y2": 718,
        "z1": 0,
        "z2": 270
      },
      "position": {
        "x": 0,
        "y": 22,
        "z": 0
      },
      "rotation": {
        "x": 0,
        "y": 0,
        "z": 0
      },
      "edge_banding": {
        "top": 0.4,
        "bottom": 0.4,
        "left": 0.4,
        "right": 0.4
      },
      "estimated": false
    },
    {
      "name": "Боковина правая",
      "type": "side_right",
      "basis_orientation": "vertical",
      "material": "ЛДСП",
      "thickness": 22,
      "dimensions": {
        "width": 270,
        "height": 696
      },
      "placement": {
        "x1": 1178,
        "x2": 1200,
        "y1": 22,
        "y2": 718,
        "z1": 0,
        "z2": 270
      },
      "position": {
        "x": 1178,
        "y": 22,
        "z": 0
      },
      "rotation": {
        "x": 0,
        "y": 0,
        "z": 0
      },
      "edge_banding": {
        "top": 0.4,
        "bottom": 0.4,
        "left": 0.4,
        "right": 0.4
      },
      "estimated": false
    },
    {
      "name": "Задняя стенка",
      "type": "back",
      "basis_orientation": "front",
      "material": "ДВП",
      "thickness": 3.2,
      "dimensions": {
        "width": 1200,
        "height": 740
      },
      "placement": {
        "x1": 0,
        "x2": 1200,
        "y1": 0,
        "y2": 740,
        "z1": 270,
        "z2": 273.2
      },
      "position": {
        "x": 0,
        "y": 0,
        "z": 270
      },
      "rotation": {
        "x": 0,
        "y": 0,
        "z": 0
      },
      "edge_banding": {
        "top": 0.4,
        "bottom": 0.4,
        "left": 0.4,
        "right": 0.4
      },
      "estimated": false,
      "override": true
    },
    {
      "name": "Перегородка 1",
      "type": "vertical_partition",
      "basis_orientation": "vertical",
      "material": "ЛДСП",
      "thickness": 22,
      "dimensions": {
        "width": 266.8,
        "height": 696
      },
      "placement": {
        "x1": 589,
        "x2": 611,
        "y1": 22,
        "y2": 718,
        "z1": 0,
        "z2": 266.8
      },
      "position": {
        "x": 589,
        "y": 22,
        "z": 0
      },
      "rotation": {
        "x": 0,
        "y": 0,
        "z": 0
      },
      "edge_banding": {
        "top": 0.4,
        "bottom": 0.4,
        "left": 0.4,
        "right": 0.4
      },
      "estimated": false
    },
    {
      "name": "Полка левая (left)",
      "type": "shelf",
      "basis_orientation": "horizont",
      "material": "ЛДСП",
      "thickness": 22,
      "dimensions": {
        "width": 567,
        "height": 266.8
      },
      "placement": {
        "x1": 22,
        "x2": 589,
        "y1": 362,
        "y2": 384,
        "z1": 0,
        "z2": 266.8
      },
      "position": {
        "x": 22,
        "y": 362,
        "z": 0
      },
      "rotation": {
        "x": 0,
        "y": 0,
        "z": 0
      },
      "edge_banding": {
        "top": 0.4,
        "bottom": 0.4,
        "left": 0.4,
        "right": 0.4
      },
      "estimated": false,
      "section_id": "left"
    },
    {
      "name": "Дверь левая",
      "type": "door_front",
      "basis_orientation": "front",
      "material": "ЛДСП",
      "thickness": 22,
      "dimensions": {
        "width": 597,
        "height": 358
      },
      "placement": {
        "x1": 2,
        "x2": 599,
        "y1": 2,
        "y2": 360,
        "z1": -22,
        "z2": 0
      },
      "position": {
        "x": 2,
        "y": 2,
        "z": -22
      },
      "rotation": {
        "x": 0,
        "y": 0,
        "z": 0
      },
      "edge_banding": {
        "top": 0.4,
        "bottom": 0.4,
        "left": 0.4,
        "right": 0.4
      },
      "estimated": false,
      "section_id": "left"
    },
    {
      "name": "Полка правая (right)",
      "type": "shelf",
      "basis_orientation": "horizont",
      "material": "ЛДСП",
      "thickness": 22,
      "dimensions": {
        "width": 567,
        "height": 266.8
      },
      "placement": {
        "x1": 611,
        "x2": 1178,
        "y1": 362,
        "y2": 384,
        "z1": 0,
        "z2": 266.8
      },
      "position": {
        "x": 611,
        "y": 362,
        "z": 0
      },
      "rotation": {
        "x": 0,
        "y": 0,
        "z": 0
      },
      "edge_banding": {
        "top": 0.4,
        "bottom": 0.4,
        "left": 0.4,
        "right": 0.4
      },
      "estimated": false,
      "section_id": "right"
    },
    {
      "name": "Дверь правая",
      "type": "door_front",
      "basis_orientation": "front",
      "material": "ЛДСП",
      "thickness": 22,
      "dimensions": {
        "width": 597,
        "height": 358
      },
      "placement": {
        "x1": 601,
        "x2": 1198,
        "y1": 2,
        "y2": 360,
        "z1": -22,
        "z2": 0
      },
      "position": {
        "x": 601,
        "y": 2,
        "z": -22
      },
      "rotation": {
        "x": 0,
        "y": 0,
        "z": 0
      },
      "edge_banding": {
        "top": 0.4,
        "bottom": 0.4,
        "left": 0.4,
        "right": 0.4
      },
      "estimated": false,
      "section_id": "right"
    }
  ],
  "drawers": [],
  "doors": [],
  "hardware": {
    "handles": {
      "type": "ручка",
      "material": "металл",
      "color": "—",
      "size": 128,
      "count": 2,
      "offset_from_top": 32,
      "furniture_encoded": ""
    },
    "legs": {
      "type": "регулируемые опоры",
      "adjustable": false,
      "color": "—",
      "height": 0,
      "count": 0
    },
    "hinges": {
      "type": "петля накладная 110°",
      "furniture_encoded": ""
    }
  },
  "constraints": {
    "default_gap": 2,
    "drawer_gap": 2,
    "door_gap": 2,
    "back_wall_offset": 3.2,
    "construction": "top_bottom_over_sides"
  },
  "basis_mapping": {
    "coordinate_system": "basis_mebelshik",
    "units": "mm",
    "ready_for_import": true,
    "placement_required": true
  },
  "warnings": [
    "ЛДСП 22 мм; столешница со свесом вперёд (z -80..270); двойная глубина 350/270; верх открыт, двери закрывают низ.",
    "Цвет/декор в ТЗ не указан — принят дефолт «Белый» (ЛДСП), подтвердить с заказчиком.",
    "Петли не указаны — приняты накладные петли 110°."
  ],
  "estimated_values": [
    "materials.color"
  ],
  "carcass_calculation": {
    "W": 1200,
    "D": 270,
    "H": 740,
    "T": 22,
    "T_back": 3.2,
    "Hleg": 0,
    "construction": "top_bottom_over_sides",
    "inner_width": "W - 2*T = 1156",
    "side_y": "22..718",
    "columns": [
      {
        "x": [
          22,
          589
        ],
        "kind": "door"
      },
      {
        "x": [
          611,
          1178
        ],
        "kind": "door"
      }
    ]
  }
}